{
  "$schema": "https://json-schema.org/draft/2020-12/schema",
  "$id": "https://soclabs.org/nanosoc-rm/schemas/executor.schema.json",
  "title": "Remote tier executor: the task the service queues and the result the agent posts back",
  "description": "interfaces.md section 27 (CR-WG-executor; David 2026-10-16 decision 1). The service queues a task (one capability of one tree at one commit); a pull agent on the EDA host claims it over the POST-only executor API, lays the commit out from its read-only mirror, runs `run.command` sandboxed and unprivileged, and posts a result. The documents are the queue's own records; nothing here is a registry file. Owner: executor.queue (server), executor.agent (agent).",
  "$ref": "#/$defs/task",
  "$defs": {
    "argv_or_shell": {
      "description": "A shell string (run by /bin/bash --noprofile --norc -c) or an argv list. Never one that sources a set_env.sh (refused on both sides).",
      "oneOf": [
        { "type": "string", "minLength": 1, "maxLength": 4000 },
        { "type": "array", "minItems": 1, "maxItems": 64, "items": { "type": "string", "minLength": 1, "maxLength": 4000 } }
      ]
    },
    "tree_path": {
      "description": "A path inside the laid-out tree: relative, no `..` part, no leading slash.",
      "type": "string",
      "pattern": "^(?!/)(?!.*(^|/)\\.\\.(/|$))[A-Za-z0-9_.+/-]{1,512}$"
    },
    "label": { "type": "string", "pattern": "^[a-z0-9][a-z0-9_.-]{0,63}$" },
    "task": {
      "description": "What the service asks one agent to run. `mirror` and every pin's `mirror` are catalogue entry ids: the agent finds `<mirror_root>/<id>.git`, a read-only replica of the service's own mirror (interfaces.md section 3 layout). The commit must already be in it; the agent never fetches from a host.",
      "type": "object",
      "required": ["schema", "subject", "mirror", "commit", "pins", "run", "labels", "requested_by"],
      "additionalProperties": false,
      "properties": {
        "schema": { "const": 1 },
        "subject": {
          "description": "What the run is evidence for. `configuration` may be null for a component-only run (a capability of a tree that is no registered configuration).",
          "type": "object",
          "required": ["component", "capability"],
          "additionalProperties": false,
          "properties": {
            "configuration": { "oneOf": [{ "$ref": "defs.schema.json#/$defs/configuration_id" }, { "type": "null" }] },
            "component": { "$ref": "defs.schema.json#/$defs/component_id" },
            "capability": { "$ref": "#/$defs/label" },
            "side": { "description": "A paired bump run (interfaces section 27.6): which side of the pair this task is.", "enum": ["now", "after"] },
            "pair": { "description": "The id both sides of a paired run share.", "type": "string", "pattern": "^[a-z0-9][a-z0-9_.-]{0,95}$" }
          }
        },
        "mirror": { "$ref": "defs.schema.json#/$defs/component_id" },
        "commit": { "$ref": "defs.schema.json#/$defs/sha" },
        "pins": {
          "description": "Submodule checkouts laid out inside the root, outermost first. Empty: the root alone.",
          "type": "array",
          "maxItems": 256,
          "items": {
            "type": "object",
            "required": ["path", "mirror", "commit"],
            "additionalProperties": false,
            "properties": {
              "path": { "$ref": "#/$defs/tree_path" },
              "mirror": { "$ref": "defs.schema.json#/$defs/component_id" },
              "commit": { "$ref": "defs.schema.json#/$defs/sha" }
            }
          }
        },
        "run": {
          "type": "object",
          "required": ["tier", "command", "budget_s"],
          "additionalProperties": false,
          "properties": {
            "tier": { "enum": ["t1", "t2", "t3", "t4", "t5", "t6"] },
            "command": { "$ref": "#/$defs/argv_or_shell" },
            "cwd": { "$ref": "#/$defs/tree_path" },
            "env": {
              "description": "Explicit environment for the command, on top of the sandbox's clean one. `${TREE}` and earlier entries expand. May not set TREE, HOME, PATH or any NANOSOC_RM_* variable.",
              "type": "object",
              "maxProperties": 64,
              "propertyNames": { "pattern": "^[A-Z_][A-Z0-9_]{0,63}$" },
              "additionalProperties": { "type": "string", "maxLength": 4000 }
            },
            "budget_s": { "type": "integer", "minimum": 1, "maximum": 172800 },
            "verdict": {
              "description": "How the result is judged. Exit `exit` (default 0) alone is PASS only when no `forbid` string appears in the output; a declared `verdicts` file (toolkit verdicts.tsv, tree-relative) adds its rows.",
              "type": "object",
              "additionalProperties": false,
              "properties": {
                "exit": { "type": "integer", "minimum": 0, "maximum": 255 },
                "forbid": { "type": "array", "maxItems": 32, "items": { "type": "string", "minLength": 1, "maxLength": 200 } },
                "verdicts": { "$ref": "#/$defs/tree_path" }
              }
            },
            "control": {
              "description": "A negative control, run after the command in the same tree: it must exit non-zero (the gate can fail). A control that exits 0 makes the run UNVERIFIED.",
              "$ref": "#/$defs/argv_or_shell"
            }
          }
        },
        "labels": {
          "description": "Every label the claiming agent must carry ([[executor.agents]] labels): the tools the command needs (vcs, xcelium, verilator, genus ...).",
          "type": "array",
          "maxItems": 16,
          "items": { "$ref": "#/$defs/label" }
        },
        "requested_by": { "type": "string", "pattern": "^[A-Za-z0-9][A-Za-z0-9_.@-]{0,63}$" },
        "reason": { "type": "string", "maxLength": 500 }
      }
    },
    "claim": {
      "description": "The answer to POST /executor/v1/claim when a task is handed out.",
      "type": "object",
      "required": ["task_id", "lease", "nonce", "lease_seconds", "task"],
      "additionalProperties": false,
      "properties": {
        "type": { "const": "task" },
        "task_id": { "type": "integer", "minimum": 1 },
        "lease": { "type": "string", "pattern": "^[0-9a-f]{32}$" },
        "nonce": { "$ref": "result-bundle.schema.json#/$defs/nonce" },
        "lease_seconds": { "type": "integer", "minimum": 10 },
        "task": { "$ref": "#/$defs/task" }
      }
    },
    "job_claim": {
      "description": "The answer to POST /executor/v1/claim when a tier JOB of the local job queue is handed out (interfaces section 27.6; the job kinds are the capabilities unit's, section 26). The agent runs `nanosoc-rm <argv>` with its own nanosoc-rm config, sandboxed, and posts {lease, exit_code, stdout, log} to /executor/v1/jobs/<job_id>/result.",
      "type": "object",
      "required": ["type", "job_id", "lease", "lease_seconds", "kind", "argv"],
      "additionalProperties": false,
      "properties": {
        "type": { "const": "job" },
        "job_id": { "type": "integer", "minimum": 1 },
        "lease": { "type": "string", "pattern": "^[0-9a-f]{32}$" },
        "lease_seconds": { "type": "integer", "minimum": 10 },
        "kind": { "type": "string", "pattern": "^[a-z][a-z0-9-]{0,63}$" },
        "argv": { "type": "array", "minItems": 1, "maxItems": 256, "items": { "type": "string", "maxLength": 4000 } }
      }
    },
    "result": {
      "description": "What the agent posts to /executor/v1/tasks/<id>/result. Every row carries the task's nonce. A result whose nonce or lease does not match the current claim is refused (409).",
      "type": "object",
      "required": ["schema", "task_id", "nonce", "executor", "sandbox", "started_at", "finished_at", "verdict",
                   "reason", "exit_code", "killed", "seconds", "over_budget", "rows", "log", "log_tail", "checkout"],
      "additionalProperties": false,
      "properties": {
        "schema": { "const": 1 },
        "task_id": { "type": "integer", "minimum": 1 },
        "nonce": { "$ref": "result-bundle.schema.json#/$defs/nonce" },
        "executor": { "$ref": "#/$defs/label" },
        "sandbox": { "description": "bwrap: bubblewrap namespaces (no home, no ssh, read-only tools). fallback: scrubbed environment only (interfaces section 27.4, residual risk).", "enum": ["bwrap", "fallback", "none"] },
        "started_at": { "$ref": "defs.schema.json#/$defs/utc" },
        "finished_at": { "$ref": "defs.schema.json#/$defs/utc" },
        "verdict": { "enum": ["PASS", "FAIL", "UNVERIFIED", "INFRA", "WARN"] },
        "reason": { "oneOf": [{ "type": "string", "maxLength": 1000 }, { "type": "null" }] },
        "exit_code": { "oneOf": [{ "type": "integer" }, { "type": "null" }] },
        "killed": { "type": "boolean" },
        "seconds": { "oneOf": [{ "type": "number", "minimum": 0 }, { "type": "null" }] },
        "over_budget": { "type": "boolean" },
        "rows": { "type": "array", "maxItems": 5000, "items": { "$ref": "result-bundle.schema.json#/$defs/verdict_row" } },
        "log": {
          "type": "object",
          "required": ["bytes", "sha256", "truncated", "uploaded"],
          "additionalProperties": false,
          "properties": {
            "bytes": { "type": "integer", "minimum": 0 },
            "sha256": { "oneOf": [{ "type": "string", "pattern": "^[0-9a-f]{64}$" }, { "type": "null" }] },
            "truncated": { "type": "boolean" },
            "uploaded": { "type": "boolean" }
          }
        },
        "log_tail": { "type": "array", "maxItems": 40, "items": { "type": "string", "maxLength": 400 } },
        "checkout": {
          "type": "object",
          "required": ["laid_out", "missing"],
          "additionalProperties": false,
          "properties": {
            "laid_out": { "type": "array", "items": { "type": "string" } },
            "missing": { "type": "array", "items": { "type": "string" } }
          }
        }
      }
    }
  }
}
