{
  "schema": 1,
  "subject": {"configuration": "eth-main", "component": "nanosoc-ethernet-chiplet", "capability": "lint"},
  "mirror": "nanosoc-ethernet-chiplet",
  "commit": "8e6d043a1b2c3d4e5f60718293a4b5c6d7e8f901",
  "pins": [
    {"path": "tidelink", "mirror": "tidelink", "commit": "1107151a2b3c4d5e6f708192a3b4c5d6e7f80912"},
    {"path": "tidechart", "mirror": "tidechart", "commit": "6cf269d1a2b3c4d5e6f708192a3b4c5d6e7f8091"}
  ],
  "run": {
    "tier": "t1",
    "command": "make lint STRICT=1",
    "cwd": ".",
    "env": {"TIDELINK_HOME": "${TREE}/tidelink", "TIDECHART_HOME": "${TREE}/tidechart"},
    "budget_s": 600,
    "verdict": {"exit": 0, "forbid": ["SKIPPED"]},
    "control": "make lint-control"
  },
  "labels": ["verilator"],
  "requested_by": "david",
  "reason": "capability lint of eth-main at its registered pins"
}
